leader_name,author,sentiment,perceived_archetype,justification,source,is_reddit,upvotes
Augustus Caesar,Hopeful-Repair-1121,negative,backstabber,Augustus Caesar is a backstabber who denounces quickly in the Classical age.,which_ai_leaders_do_you_like_and_hate,True,1
Pocatello,Hopeful-Repair-1121,negative,expansionist,Pocatello expands rapidly using his unique ability and also builds many wonders.,which_ai_leaders_do_you_like_and_hate,True,1
Haile Selassie,Hopeful-Repair-1121,negative,warmonger,Haile Selassie is a tough domination target due to strong unique units and wonders.,which_ai_leaders_do_you_like_and_hate,True,1
Hiawatha,Hopeful-Repair-1121,negative,expansionist,Hiawatha constantly expands even onto useless tiles throughout the game.,which_ai_leaders_do_you_like_and_hate,True,1
Alexander,Hopeful-Repair-1121,negative,diplomatic,Alexander allies all city states with gold and is hostile to neighboring civilizations.,which_ai_leaders_do_you_like_and_hate,True,1
Bismarck,Hopeful-Repair-1121,negative,warmonger,Bismarck is a hypocritical warmonger who denounces others while expanding aggressively.,which_ai_leaders_do_you_like_and_hate,True,1
Wu Zetian,Hopeful-Repair-1121,negative,backstabber,Wu Zetian is a dramatic backstabber who denounces quickly and acts as an antagonist.,which_ai_leaders_do_you_like_and_hate,True,1
Theodora,zk2020reborn,negative,religious,Theodora is feared for her powerful religious strategy using Religious Center and Jesuit Education.,which_ai_leaders_do_you_like_and_hate,True,2
Dido,treecfc,negative,backstabber,Dido is described as consistently backstabbing someone every game.,which_ai_leaders_do_you_like_and_hate,True,2
Hiawatha,KeyDrive0,negative,expansionist,Hiawatha is immediately cited as one of the worst expansionist leaders in the game.,which_ai_leaders_do_you_like_and_hate,True,1
Alexander,KeyDrive0,negative,city_spammer,"Alexander sends settlers globally, ignoring prime land to settle aggressively near the player.",which_ai_leaders_do_you_like_and_hate,True,1
Doge,KeyDrive0,negative,diplomatic,"Venice's Merchant of Venice permanently annexes city states, disrupting player alliances and war plans.",which_ai_leaders_do_you_like_and_hate,True,1
Nobunaga,unknown,positive,warmonger,Player won their first domination game using Nobunaga.,which_ai_leaders_do_you_like_and_hate,True,1
Boudicca,Medium-Perspective43,negative,religious,"Boudicca is expansionist, aggressive, and spams missionaries frequently.",which_ai_leaders_do_you_like_and_hate,True,1
Alexander,Sniyarki,negative,warmonger,Alexander is considered one of the most hated leaders in the game.,which_ai_leaders_do_you_like_and_hate,True,1
Siam,Sniyarki,negative,unpredictable,Siam is considered one of the most hated leaders in the game.,which_ai_leaders_do_you_like_and_hate,True,1
Harun al-Rashid,Cuavooo,negative,diplomatic,"Arabia finds allies, denounces enemies, and forces religion aggressively.",which_ai_leaders_do_you_like_and_hate,True,1
Genghis Khan,Cuavooo,mixed,warmonger,Mongolia is a loyal ally when behind but turns hostile as a neighbor.,which_ai_leaders_do_you_like_and_hate,True,1
Harun al-Rashid,RedEyeBlueOcean,negative,diplomatic,Arabia nearly won a diplomatic victory and is considered a top-tier threat.,which_ai_leaders_do_you_like_and_hate,True,1
Genghis Khan,RedEyeBlueOcean,mixed,warmonger,"Genghis is loyal unless neighboring you, then becomes a large war threat.",which_ai_leaders_do_you_like_and_hate,True,1
Shaka,Delicious-Diamond-86,negative,warmonger,Strong negative reaction expressed toward Shaka with no further elaboration.,which_ai_leaders_do_you_like_and_hate,True,1
Shaka,Tricky_Rate7883,mixed,warmonger,Shaka is hard to befriend but becomes the most loyal ally if achieved.,which_ai_leaders_do_you_like_and_hate,True,1
Shaka,LinuxAmbassador,positive,warmonger,Shaka has the highest expansion and war stats and is a straightforward extreme warmonger.,which_ai_leaders_do_you_like_and_hate,True,1
Gustavus Adolphus,LinuxAmbassador,negative,expansionist,Gustavus over-expands and never does anything noteworthy as an AI opponent.,which_ai_leaders_do_you_like_and_hate,True,1
Montezuma,Pixielized,negative,warmonger,Extreme hatred expressed toward Montezuma with hyperbolic violent sentiment.,which_ai_leaders_do_you_like_and_hate,True,1
Venice,Traditional_Loan_177,negative,diplomatic,Venice is listed as the most hated leader by this player.,which_ai_leaders_do_you_like_and_hate,True,1
Alexander the Great,firsttimegaren,negative,warmonger,Alexander constantly declares war and cannot be trusted to stay peaceful.,who_is_the_most_warmonger_civ_leader,True,1
Alexander,u/Buddhas_butthole,negative,warmonger,User believes Alexander deserves to be on the warmonger list over others.,who_is_the_most_warmonger_civ_leader,True,1
Alexander,u/VeritableLeviathan,mixed,city_spammer,Alexander settles too many cities and snowballs before targeting weaker opponents.,who_is_the_most_warmonger_civ_leader,True,1
Genghis Khan,lad1dad1,negative,warmonger,Genghis Khan repeatedly declared war every hundred years without stopping.,who_is_the_most_warmonger_civ_leader,True,1
Genghis,hurricane1613286,negative,backstabber,Genghis immediately turned hostile after being shown trust and kindness.,who_is_the_most_warmonger_civ_leader,True,1
Alexander,u/KingHavana,negative,warmonger,User refused to vote because Alexander was not included as a warmonger option.,who_is_the_most_warmonger_civ_leader,True,1
Shaka,Southern_Source_2580,positive,warmonger,Shaka is aggressive but proved loyal by defending the user against Alexander.,who_is_the_most_warmonger_civ_leader,True,1
Alexander,Southern_Source_2580,negative,warmonger,"Alexander attacked the user unprovoked, requiring Shaka's help to repel.",who_is_the_most_warmonger_civ_leader,True,1
Shaka,sesaman,negative,warmonger,User prefers to crush Shaka quickly before he can build powerful impi units.,who_is_the_most_warmonger_civ_leader,True,1
Alexander,u/_Ungespuelt_,negative,backstabber,Alexander will backstab you at any moment making friendship pointless.,who_is_the_most_warmonger_civ_leader,True,1
Shaka,u/_Ungespuelt_,mixed,warmonger,User questions whether Shaka is loyal despite his aggressive warmonger reputation.,who_is_the_most_warmonger_civ_leader,True,1
Shaka,Rico_Rebelde,mixed,warmonger,Shaka is highly aggressive but extremely loyal with very low deceptiveness.,who_is_the_most_warmonger_civ_leader,True,1
Alexander,Rico_Rebelde,negative,backstabber,Alexander has below average loyalty and deceptiveness making him untrustworthy.,who_is_the_most_warmonger_civ_leader,True,1
Shaka,u/Xaphe,positive,warmonger,Shaka is very loyal and maintained friendship even through competing ideologies.,who_is_the_most_warmonger_civ_leader,True,1
Attila,Forsaken_Mousse5271,negative,warmonger,User considers Attila one of the most aggressive warmonger leaders in the game.,who_is_the_most_warmonger_civ_leader,True,1
Shaka,Forsaken_Mousse5271,negative,warmonger,User considers Shaka one of the most aggressive warmonger leaders in the game.,who_is_the_most_warmonger_civ_leader,True,1
Atilla,unknown,negative,warmonger,Atilla hates everyone and war is always guaranteed as his neighbor.,who_is_the_most_warmonger_civ_leader,True,1
Shaka,unknown,mixed,warmonger,Shaka can be loyal and friendly but relentlessly pursues wars for multiple eras.,who_is_the_most_warmonger_civ_leader,True,1
Shaka,u/poesviertwintig,positive,diplomatic,Shaka is a great ally for domination runs when on the other side of the world.,who_is_the_most_warmonger_civ_leader,True,1
Atilla,ZhouDa,negative,warmonger,Atilla demanded cities for peace and kept attacking through multiple waves.,who_is_the_most_warmonger_civ_leader,True,1
Shaka,EfficiencySlight8845,negative,warmonger,Shaka does not back off once he starts attacking and persists for a long time.,who_is_the_most_warmonger_civ_leader,True,1
Shaka,u/rogozh1n,negative,unpredictable,Shaka repeatedly redeclares war even when totally unprepared after being beaten back.,who_is_the_most_warmonger_civ_leader,True,1
Pacal,u/neon_trotsky_,negative,backstabber,Pacal declared an emergency after peacing out and resumed war with a weakened army.,who_is_the_most_warmonger_civ_leader,True,1
Shaka,u/Due_Leather1771,positive,diplomatic,Due_Leather1771 has always had Shaka as an ally in every game played.,who_is_the_most_warmonger_civ_leader,True,1
Napoleon,u/Jefrejtor,negative,warmonger,Napoleon declared war on every single neighboring civ in one game.,who_is_the_most_warmonger_civ_leader,True,1
Attila,Rofdo,negative,warmonger,Attila has the highest war diplomacy bias of 8 according to civdata.com.,who_is_the_most_warmonger_civ_leader,True,1
Ashurbanipal,Rofdo,negative,warmonger,Ashurbanipal has the highest war diplomacy bias of 8 according to civdata.com.,who_is_the_most_warmonger_civ_leader,True,1
Montezuma,Rofdo,negative,warmonger,Montezuma has the highest war diplomacy bias of 8 according to civdata.com.,who_is_the_most_warmonger_civ_leader,True,1
Shaka,Rofdo,negative,expansionist,Shaka has the highest expansion bias of 11 out of all AI leaders.,who_is_the_most_warmonger_civ_leader,True,1
Napoleon,Rofdo,negative,warmonger,Napoleon has the highest war diplomacy bias of 8 according to civdata.com.,who_is_the_most_warmonger_civ_leader,True,1
Montezuma,Sambikes1,negative,warmonger,Montezuma always declares war without exception in the author's experience.,who_is_the_most_warmonger_civ_leader,True,1
Ghandi,u/SkipperJonJones,mixed,unpredictable,Gandhi is mentioned as a meme warmonger reference with no elaboration.,who_is_the_most_warmonger_civ_leader,True,1
Genghis Khan,MeadKing,negative,warmonger,"Genghis Khan constantly attacks City States, ruining all his diplomatic relationships.",who_is_the_most_warmonger_civ_leader,True,1
Shaka,amenoniwa,mixed,warmonger,Shaka is a warmonger but can easily be bribed to attack other AIs.,who_is_the_most_warmonger_civ_leader,True,1
Suleiman,amenoniwa,negative,warmonger,Suleiman forward settles and cannot easily be bribed into wars.,who_is_the_most_warmonger_civ_leader,True,1
Nobunaga,amenoniwa,negative,warmonger,Nobunaga cannot easily be bribed and behaves aggressively like Suleiman.,who_is_the_most_warmonger_civ_leader,True,1
Napoleon,WC-BucsFan,negative,warmonger,Napoleon attacks the author every single game without fail.,who_is_the_most_warmonger_civ_leader,True,1
Napoleon,u/Prithvishivprasad,negative,warmonger,Napoleon is ranked second only to Shaka in warmonger behavior.,who_is_the_most_warmonger_civ_leader,True,1
Shaka,u/Prithvishivprasad,negative,warmonger,Shaka is ranked the top warmonger above Napoleon by the author.,who_is_the_most_warmonger_civ_leader,True,1
Montezuma,u/hagnat,negative,warmonger,Author questions Montezuma's absence from the warmonger discussion implying notoriety.,who_is_the_most_warmonger_civ_leader,True,1
Ghandi,u/burekstein,mixed,unpredictable,Gandhi is cited as the meme answer for most warmongering AI leader.,who_is_the_most_warmonger_civ_leader,True,1
Askia,u/burekstein,negative,warmonger,Askia inevitably declares war when the player has a smaller military.,who_is_the_most_warmonger_civ_leader,True,1
Attila,unknown,negative,backstabber,Attila declares war even when a declaration of friendship is active.,who_is_the_most_warmonger_civ_leader,True,1
Suleiman,Vhal14,positive,peaceful,Suleiman is among the least warmongering leaders based on player experience.,who_is_the_most_warmonger_civ_leader,True,1
Bismarck,Vhal14,positive,peaceful,Bismarck is considered one of the least warmongering leaders by experience.,who_is_the_most_warmonger_civ_leader,True,1
Genghis Khan,Vhal14,negative,warmonger,Genghis Khan always wants to conquer city states.,who_is_the_most_warmonger_civ_leader,True,1
Nobunaga,Vhal14,mixed,warmonger,Nobunaga is described as a mild warmonger.,who_is_the_most_warmonger_civ_leader,True,1
Attila,Vhal14,negative,warmonger,Attila is almost always at war with someone.,who_is_the_most_warmonger_civ_leader,True,1
Shaka,Vhal14,negative,warmonger,Shaka is always at war with somebody when he has his Impi carpet.,who_is_the_most_warmonger_civ_leader,True,1
Montezuma,Vhal14,negative,warmonger,Montezuma is considered on par with Shaka in warmongering.,who_is_the_most_warmonger_civ_leader,True,1
Montezuma,Rossticles,negative,warmonger,Montezuma receives an honorable mention for being highly aggressive.,who_is_the_most_warmonger_civ_leader,True,1
Ramkhamhaeng,Rossticles,negative,unpredictable,Ramkhamhaeng is described as quite testy.,who_is_the_most_warmonger_civ_leader,True,1
Elizabeth,g0tmelk,negative,warmonger,Elizabeth always wants war according to the commenter.,who_is_the_most_warmonger_civ_leader,True,2
Gandhi,Queasy_County,mixed,warmonger,Gandhi's absence from the warmonger list is questioned by the commenter.,who_is_the_most_warmonger_civ_leader,True,1
Montezuma,Life-Ad-6480,negative,warmonger,Montezuma would place 2nd or 3rd on the warmongering list per the OP.,who_is_the_most_warmonger_civ_leader,True,1
Gandhi,SerenityPrim3,negative,warmonger,Gandhi was forgotten but should be on the warmonger list.,who_is_the_most_warmonger_civ_leader,True,1
Shaka,Jayken,mixed,unpredictable,"Shaka is hit or miss, either a best friend or constantly at war.",who_is_the_most_warmonger_civ_leader,True,1
Attila,Jayken,mixed,warmonger,Attila is a monster early game but becomes a joke by late game.,who_is_the_most_warmonger_civ_leader,True,1
Alexander,Boulderfrog1,mixed,warmonger,Alexander's absence from the warmonger list is questioned.,who_is_the_most_warmonger_civ_leader,True,2
Genghis Khan,mrtiptonic,mixed,warmonger,Playing as Genghis Khan with Autocracy yet maintaining highest happiness is ironic.,who_is_the_most_warmonger_civ_leader,True,1
Shaka,Wadero,negative,backstabber,Shaka immediately declared war after taking Poland's capital despite friendly relations.,who_is_the_most_warmonger_civ_leader,True,2
Harald Bluetooth,Wadero,negative,diplomatic,Harald Bluetooth denounced the player for warmonger despite them defending against Shaka.,who_is_the_most_warmonger_civ_leader,True,2
Gandhi,u/moreckm8293,negative,warmonger,Gandhi is called the biggest warmonger and questioned for absence from list.,who_is_the_most_warmonger_civ_leader,True,1
Shaka,u/themolestedsliver,negative,warmonger,Shaka repeatedly declared war and mobilized armies even right after peace deals.,who_is_the_most_warmonger_civ_leader,True,1
Attila,u/Xaphe,negative,warmonger,Attila always attacks City States then escalates to major civilizations.,who_is_the_most_warmonger_civ_leader,True,1
Caesar,Definitely-JT,negative,warmonger,Caesar frequently causes conflict and confrontations with the player.,who_is_the_most_warmonger_civ_leader,True,1
Boudica,unknown,positive,unpredictable,Liked despite a love-hate relationship and erratic sword-dancing behavior.,civfanatics_favorite_hated,False,1
Suleiman,unknown,positive,peaceful,Always seems happy and friendly even when declaring war.,civfanatics_favorite_hated,False,1
Attila,unknown,mixed,warmonger,Friendly later but frequently declares war within first 40 turns.,civfanatics_favorite_hated,False,1
Ashurbanipal,unknown,positive,peaceful,Never goes to war and remains consistently friendly regardless of global politics.,civfanatics_favorite_hated,False,1
Wu Zetian,unknown,positive,diplomatic,Neutral and frequently becomes a reliable trading partner or ally.,civfanatics_favorite_hated,False,1
Shaka,unknown,mixed,warmonger,Aggressive but honest and transparent in his diplomatic attitudes.,civfanatics_favorite_hated,False,1
Ramses II,unknown,negative,wonder_builder,"Weird AI, constantly guarded and obsessed with building every wonder.",civfanatics_favorite_hated,False,1
Elizabeth,unknown,negative,unpredictable,"Extremely annoying, erratic, and randomly hostile without clear reason.",civfanatics_favorite_hated,False,1
Ramkhamhaeng,unknown,negative,backstabber,Attacks neighbors freely but complains when the player does the same.,civfanatics_favorite_hated,False,1
Isabella,unknown,negative,religious,"Spams missionaries, flip-flops between friendly and hostile, constantly denounces.",civfanatics_favorite_hated,False,1
Kamehameha,unknown,negative,expansionist,Aggressively settles cities in the middle of the player's empire every game.,civfanatics_favorite_hated,False,1
Haile Selassie,unknown,negative,backstabber,Picks on others but complains to everyone when retaliated against.,civfanatics_favorite_hated,False,1
Pacal,unknown,negative,wonder_builder,Grabs every faith wonder and denounces players who compete with him.,civfanatics_favorite_hated,False,1
Ahmad al-Mansur,unknown,negative,expansionist,Settles cities uncomfortably close to the player's capital.,civfanatics_favorite_hated,False,1
William,unknown,negative,expansionist,Settles cities uncomfortably close to the player's capital.,civfanatics_favorite_hated,False,1
Oda Nobunaga,unknown,negative,warmonger,Drops cities nearby then declares war and remains hostile indefinitely.,civfanatics_favorite_hated,False,1
Boudicca,unknown,positive,unpredictable,Listed among liked leaders by the second commenter.,civfanatics_favorite_hated,False,1
William of Orange,unknown,positive,diplomatic,Listed among liked leaders by the second commenter.,civfanatics_favorite_hated,False,1
Dido,unknown,positive,expansionist,Listed among liked leaders by the second commenter.,civfanatics_favorite_hated,False,1
Harald Bluetooth,unknown,positive,warmonger,Described as reasonable and friendly but still loves to fight wars.,civfanatics_favorite_hated,False,1
Pachacuti,unknown,mixed,backstabber,Similar to Harald but smaller positives and described as more treacherous.,civfanatics_favorite_hated,False,1
Askia,unknown,mixed,expansionist,Often weak punching bag but annoyingly settles distant cities near the player.,civfanatics_favorite_hated,False,1
Catherine,unknown,mixed,unpredictable,Used to be strong competition and runaway but now frequently gets dominated.,civfanatics_favorite_hated,False,1
Bismarck,unknown,positive,warmonger,Described as a relatively nice guy who likes to fight and started running away.,civfanatics_favorite_hated,False,1
Neby,unknown,mixed,peaceful,A joy to encounter but unfortunately not very competent as an AI.,civfanatics_favorite_hated,False,1
Monty,unknown,positive,warmonger,Humorously declares wars then immediately offers peace deals with concessions.,civfanatics_favorite_hated,False,1
Alexander,unknown,negative,expansionist,"Described as unreasonable, hateful for no reason, and typically a runaway expander.",civfanatics_favorite_hated,False,1
Hiawatha,unknown,negative,city_spammer,Expands in useless places and can overwhelm most other AIs early on.,civfanatics_favorite_hated,False,1
Polynesia,unknown,negative,expansionist,Meets others before the player and madly expands toward the player's territory.,civfanatics_favorite_hated,False,1
Sejong,unknown,negative,warmonger,"Sejong techs extremely fast, spams cities, then attacks with superior units.",civfanatics_favorite_hated,False,1
Ramesses,unknown,negative,wonder_builder,"Ramesses constantly steals wonders, leaving none for others.",civfanatics_favorite_hated,False,1
Gustavus,unknown,mixed,warmonger,Gustavus is worth befriending but implied threatening if not allied.,civfanatics_favorite_hated,False,1
Augustus,unknown,negative,warmonger,Augustus will predictably invade if you start nearby.,civfanatics_favorite_hated,False,1
Wu,unknown,positive,peaceful,Wu has great theme music and is usually quite reasonable to deal with.,civfanatics_favorite_hated,False,1
Nebuchadnezzar,unknown,positive,peaceful,Nebby is generally good to be friends with.,civfanatics_favorite_hated,False,1
Washington,unknown,positive,peaceful,Washington is a very loyal friend unless you pursue warmongering.,civfanatics_favorite_hated,False,1
Ahmad,unknown,positive,diplomatic,Ahmad is always friendly and easy to maintain good relations with.,civfanatics_favorite_hated,False,1
Augustus Caesar,unknown,negative,backstabber,Augustus often backstabs shortly after offering friendship.,civfanatics_favorite_hated,False,1
Darius,unknown,negative,warmonger,Darius builds a massive army and warmongering under the radar.,civfanatics_favorite_hated,False,1
Gustavus Adolphus,unknown,positive,diplomatic,"Gustavus is extremely reasonable, warm, and generally a reliable ally.",civfanatics_favorite_hated,False,1
Napoleon,unknown,mixed,warmonger,Napoleon aggressively invades weak civs but is predictable and easily bribed.,civfanatics_favorite_hated,False,1
Theodora,unknown,mixed,backstabber,Theodora is generally easygoing but can be moody and backstab occasionally.,civfanatics_favorite_hated,False,1
Gandhi,unknown,mixed,peaceful,Gandhi is passive and friendly but considered a pushover with no military threat.,civfanatics_favorite_hated,False,1
Pocatello,unknown,positive,peaceful,Pocatello is very passive and straightforwardly fair in dealings.,civfanatics_favorite_hated,False,1
Genghis Khan,unknown,mixed,warmonger,Genghis rarely poses a major threat technologically and can be bribed easily.,civfanatics_favorite_hated,False,1
Maria Theresa,unknown,negative,unpredictable,"Maria Theresa is extremely passive-aggressive, stealing city states and constantly annoying.",civfanatics_favorite_hated,False,1
Alexander the Great,unknown,negative,warmonger,Alexander has the most annoying voice and declares war early while hogging city states.,civfanatics_favorite_hated,False,1
Alejandro,unknown,negative,diplomatic,Constantly targets crucial city-state allies making them nearly impossible to reclaim.,civfanatics_favorite_hated,False,1
Cassimir,unknown,positive,peaceful,Remarkably forgiving AI that seeks friendship even after losing cities in war.,civfanatics_favorite_hated,False,1
Pedro II,unknown,positive,diplomatic,Easy to deal with and almost always willing to form declarations of friendship.,civfanatics_favorite_hated,False,1
Ahmad Al Mansur,unknown,mixed,wonder_builder,Easy to befriend but annoyingly steals wonders despite being an ally.,civfanatics_favorite_hated,False,1
Montezuma,unknown,negative,warmonger,"Irritating and arrogant, constantly insulting and making demands regarding city states.",civfanatics_favorite_hated,False,1
Ahmad Al-Mansur,unknown,positive,diplomatic,Described as a reliable ally focused on trade and avoiding war for profit.,civfanatics_favorite_hated,False,1
Enrico Dandolo,unknown,positive,diplomatic,Portrayed as a friendly old man always proposing profitable trade schemes.,civfanatics_favorite_hated,False,1
Alex,unknown,negative,warmonger,Denounces players from extreme distances unprovoked and repeatedly.,civfanatics_favorite_hated,False,1
Genghis,unknown,mixed,warmonger,Genghis is a reliable late-game war partner but eats city states annoyingly.,civfanatics_favorite_hated,False,1
Harun Al-Rashid,unknown,mixed,city_spammer,Generally a good friend but tends to spam cities in the late game.,civfanatics_favorite_hated,False,1
Bismark,unknown,mixed,backstabber,Most reasonable warmonger but suffers from frequent and chronic backstabbing behavior.,civfanatics_favorite_hated,False,1
Ghandi,unknown,negative,unpredictable,Constantly denounces and harasses the player regardless of their actions.,civfanatics_favorite_hated,False,1
Rammy,unknown,negative,backstabber,Launches surprise attacks then hypocritically denounces the player after losing.,civfanatics_favorite_hated,False,1
William,Cpt Oblivious,positive,diplomatic,William is friendly and proactively brings Research Agreements to the player.,civfanatics_favorite_hated,False,1
Theodora,Cpt Oblivious,positive,peaceful,Theodora is a willing ally and rarely backstabs despite being passive.,civfanatics_favorite_hated,False,1
Montezuma,Cpt Oblivious,mixed,warmonger,Montezuma is consistent and entertaining but aggressive and unpredictable early game.,civfanatics_favorite_hated,False,1
William,njmfff,negative,unpredictable,William asks for DoF then turns Guarded the same turn for no reason.,civfanatics_favorite_hated,False,1
Theodora,njmfff,positive,diplomatic,Theodora is a good friend who never backstabs and offers constant trade deals.,civfanatics_favorite_hated,False,1
Montezuma,njmfff,mixed,warmonger,Montezuma is forgiving and will seek friendship even after repeated wars.,civfanatics_favorite_hated,False,1
Cathy,njmfff,mixed,unpredictable,Cathy either wants to kill you or remains a trusted friend until the end.,civfanatics_favorite_hated,False,1
August,njmfff,mixed,backstabber,August is either very loyal or backstabs depending on proximity and situation.,civfanatics_favorite_hated,False,1
Nebuchadnezzar,njmfff,negative,wonder_builder,Nebuchadnezzar is guarded and repeatedly denounces players who build wonders he wants.,civfanatics_favorite_hated,False,1
Askia,njmfff,negative,backstabber,"Askia backstabs, hypocritically hates warmongers, and suicidally picks fights he loses.",civfanatics_favorite_hated,False,1
Ghandi,njmfff,positive,wonder_builder,Gandhi is a reliable trade partner who rarely expands but hoards cultural wonders.,civfanatics_favorite_hated,False,1
Alexander,unknown,negative,warmonger,Alexander spontaneously declares war and acts hyper-aggressively like a schoolyard bully.,civfanatics_most_annoying,False,1
Augustus,unknown,negative,backstabber,Augustus repeatedly backstabs by attacking during wars then feigning friendship afterward.,civfanatics_most_annoying,False,1
Washington,unknown,negative,expansionist,Washington falsely accuses the player of aggression then attacks in an expansionist frenzy.,civfanatics_most_annoying,False,1
Bismark,unknown,negative,unpredictable,"Bismark is described as irrational and vexing, appearing frequently in random games.",civfanatics_most_annoying,False,1
Babylon,unknown,negative,unpredictable,Babylon's leader is unpleasant and off-putting to deal with as an opponent.,civfanatics_most_annoying,False,1
