leader_name,author,sentiment,perceived_archetype,justification,source,is_reddit,upvotes
Elisabeth,unknown,negative,unpredictable,Elisabeth is impossible to please and turns hostile almost immediately upon meeting.,civfanatics_most_annoying,False,1
Gandhi,unknown,negative,peaceful,Gandhi stays peaceful but constantly insults the player despite having few cities.,civfanatics_most_annoying,False,1
Ramses,unknown,mixed,wonder_builder,Ramses only becomes an issue when the player builds many wonders.,civfanatics_most_annoying,False,1
Ghandi,unknown,negative,unpredictable,Gandhi is an untrustworthy and irritating presence throughout the game.,civfanatics_most_annoying,False,1
Ramkhamhaeng,unknown,negative,backstabber,"Ramkhamhaeng betrayed the player's trust once, leaving a lasting negative impression.",civfanatics_most_annoying,False,1
China,unknown,negative,warmonger,China is arrogant but fails to back it up with actual battlefield performance.,civfanatics_most_annoying,False,1
Monty,unknown,mixed,warmonger,Monty is enjoyably overconfident and entertaining when he overextends himself.,civfanatics_most_annoying,False,1
Ottomans,unknown,negative,warmonger,The Ottomans frequently declare early wars but never manage to cause real damage.,civfanatics_most_annoying,False,1
Siam,unknown,negative,warmonger,Siam is called a warmonger for destroying the Ottomans.,civfanatics_most_annoying,False,1
Elizabeth,unknown,negative,backstabber,Elizabeth is basically never friendly and always an annoyance.,civfanatics_most_annoying,False,1
Bismarck,unknown,negative,warmonger,Bismarck is among the leaders who hate the player most.,civfanatics_most_annoying,False,1
Greece,unknown,negative,diplomatic,Greece frequently buys out every city state early in the game.,civfanatics_most_annoying,False,1
France,unknown,negative,diplomatic,"France also buys city states aggressively, complicating early diplomacy.",civfanatics_most_annoying,False,1
Elizabeth,ense7en,negative,unpredictable,Elizabeth is basically never friendly and always an annoyance to deal with.,civfanatics_most_annoying,False,1
Alexander,ense7en,negative,diplomatic,Greece loves to buy out every single city state early in the game.,civfanatics_most_annoying,False,1
Napoleon,ense7en,negative,diplomatic,France loves to buy out every single city state early in the game.,civfanatics_most_annoying,False,1
Catherine,unknown,negative,backstabber,Catherine steals allied city states then hypocritically complains about your influence.,civfanatics_most_annoying,False,1
Wu Zetian,unknown,negative,wonder_builder,China building the Great Wall one square at a time is especially tedious.,civfanatics_most_annoying,False,1
Hiawatha,unknown,negative,expansionist,Hiawatha often spawns alone on a continent and races ahead in science.,civfanatics_most_annoying,False,1
Suleiman,unknown,negative,warmonger,The Ottomans declare war from across the continent with no realistic chance of winning.,civfanatics_most_annoying,False,1
Alex,unknown,negative,warmonger,Alex maintains a dangerous army while keeping up science and policies throughout.,civfanatics_strongest_ai,False,1
Darius,unknown,negative,wonder_builder,"Darius skyrockets ahead in production, science, policies, and wonders consistently.",civfanatics_strongest_ai,False,1
Catherine,unknown,negative,city_spammer,Catherine spams cities and wonders while maintaining strong science and military presence.,civfanatics_strongest_ai,False,1
Atilla,unknown,mixed,warmonger,"Atilla destroys early neighbors but burns cities, becoming irrelevant in mid-late game.",civfanatics_strongest_ai,False,1
Shaka,unknown,mixed,warmonger,Shaka kills many early but falls behind technologically and earns global ire.,civfanatics_strongest_ai,False,1
Dido,unknown,mixed,expansionist,Dido falls off mid-late game after focusing too much on military over infrastructure.,civfanatics_strongest_ai,False,1
the Khan,unknown,mixed,warmonger,The Khan focuses on early military but lacks sustainability for late-game victory.,civfanatics_strongest_ai,False,1
Cathy,unknown,positive,expansionist,Cathy can run away with science or culture victories using Rationalism.,civfanatics_strongest_ai,False,1
Sejong,unknown,positive,peaceful,Sejong is a strong candidate for science or culture victories with Rationalism.,civfanatics_strongest_ai,False,1
Maria,unknown,positive,wonder_builder,Maria can get far ahead as a culture civ beelining internet with Rationalism.,civfanatics_strongest_ai,False,1
Napoleon,unknown,positive,wonder_builder,Napoleon can advance far as a culture civ using Rationalism and internet beeline.,civfanatics_strongest_ai,False,1
Ramses,unknown,positive,wonder_builder,Ramses can get far ahead as a culture civ with Rationalism beelining internet.,civfanatics_strongest_ai,False,1
Pedro,unknown,positive,wonder_builder,Pedro can advance significantly as a culture civ using Rationalism.,civfanatics_strongest_ai,False,1
Kamehameha,unknown,positive,wonder_builder,Kamehameha can get far ahead as a culture civ with Rationalism.,civfanatics_strongest_ai,False,1
Attila,miaasma,positive,warmonger,Attila can run away with the game by conquering enough capitals.,civfanatics_strongest_ai,False,1
alex,miaasma,positive,diplomatic,"Alex is always allied with every city state, gaining significant advantages.",civfanatics_strongest_ai,False,1
America,miaasma,positive,unpredictable,America magically comes out ahead in nearly every game for unclear reasons.,civfanatics_strongest_ai,False,1
Egypt,unknown,positive,wonder_builder,Egypt's natural wonder mongering with Tradition makes them a strong tall civ.,civfanatics_strongest_ai,False,1
Shoshone,unknown,positive,expansionist,"Shoshone combines expansionism and Rationalism for fast, powerful victories.",civfanatics_strongest_ai,False,1
Korea,unknown,mixed,peaceful,Korea used to win effectively but became weaker after the Piety patch.,civfanatics_strongest_ai,False,1
Poca,unknown,positive,peaceful,Pocatello is one of the few AIs who frequently chooses Rationalism.,civfanatics_strongest_ai,False,1
America,unknown,positive,wonder_builder,America is noticed for extreme wonder building and leading the tech race.,civfanatics_strongest_ai,False,1
Alexander,unknown,negative,diplomatic,Alexander is the strongest AI and must be controlled by limiting city-states.,civfanatics_strongest_ai,False,1
Bismarck,unknown,negative,expansionist,Bismarck is a perennial runaway in the author's games.,civfanatics_strongest_ai,False,1
Casimir,unknown,positive,peaceful,Casimir is less frequently a runaway but always stays relevant.,civfanatics_strongest_ai,False,1
Pocatello,unknown,positive,expansionist,Pocatello is less frequently a runaway but consistently remains relevant.,civfanatics_strongest_ai,False,1
Suleiman,unknown,positive,peaceful,Suleiman is less frequently a runaway but always stays at least relevant.,civfanatics_strongest_ai,False,1
Germany,Popedesu,negative,city_spammer,Germany relentlessly settles every available tile including tiny and poor locations.,civfanatics_strongest_ai,False,1
Hiawatha,unknown,negative,expansionist,"Hiawatha became a runaway in Gods and Kings, causing genuine fear.",civfanatics_strongest_ai,False,1
Caesar,unknown,negative,warmonger,"Caesar conquered many cities rapidly despite severe unhappiness penalties, throwing modern units.",civfanatics_strongest_ai,False,1
Russia,unknown,mixed,expansionist,Russia rises early in power rankings but always plateaus without achieving victory.,civfanatics_strongest_ai,False,1
Babylon,unknown,negative,peaceful,"Babylon consistently threatens a spaceship victory, forcing others to shift strategy.",civfanatics_strongest_ai,False,1
Mongolia,unknown,negative,warmonger,Mongolia consistently converts conquests into a real chance at victory condition.,civfanatics_strongest_ai,False,1
Rome,unknown,positive,expansionist,Rome is listed among civs that genuinely compete for victory conditions.,civfanatics_strongest_ai,False,1
Poland,unknown,positive,expansionist,Poland is noted as a heavy hitter that truly competes in games.,civfanatics_strongest_ai,False,1
Ethiopia,unknown,positive,peaceful,Ethiopia is mentioned as one of the civs that can really compete.,civfanatics_strongest_ai,False,1
Siam,unknown,positive,diplomatic,Siam is listed among civs that genuinely compete for victory conditions.,civfanatics_strongest_ai,False,1
Arabia,unknown,positive,peaceful,Arabia dominates science from the Renaissance onward even if less relevant early.,civfanatics_strongest_ai,False,1
Iroquois,unknown,mixed,expansionist,Iroquois used to compete strongly but has weakened after several patches.,civfanatics_strongest_ai,False,1
Venice,unknown,mixed,diplomatic,Venice is targeted early when capital becomes valuable enough to capture.,civfanatics_strongest_ai,False,1
Zulu,unknown,negative,warmonger,"Zulu frequently puppets and annexes cities, marking them as true warmongers.",civfanatics_strongest_ai,False,1
Huns,unknown,negative,warmonger,"Huns commonly puppet and annex cities, qualifying as true warmongers.",civfanatics_strongest_ai,False,1
Assyria,unknown,negative,warmonger,Assyria frequently puppets or annexes cities like other true warmongers.,civfanatics_strongest_ai,False,1
Gandhi,unknown,mixed,unpredictable,"Gandhi is humorously referenced as a nuclear threat, subverting his peaceful reputation.",civfanatics_strongest_ai,False,1
Zulu,miaasma,mixed,warmonger,Zulu are aggressive neighbors but never seem to achieve victory conditions.,civfanatics_strongest_ai,False,1
Zulu,ShakaKhan,mixed,warmonger,Zulu constantly threaten players but fail to contest any victory condition.,civfanatics_strongest_ai,False,1
Theodora,ShakaKhan,negative,expansionist,"Theodora consistently becomes a runaway leader, especially without founding a religion.",civfanatics_strongest_ai,False,1
Sweden,docbud,negative,expansionist,Sweden aggressively forward settled close to borders to steal valuable resource tiles.,civfanatics_strongest_ai,False,1
