leader_name,author,sentiment,perceived_archetype,justification,source,is_reddit,upvotes
Washington,u/XxDiCaprioxX,negative,backstabber,Washington likes to denounce and backstab but is ineffective at it.,im_a_noob_can_you_describe_all_civ_personalities,True,1
Harun,u/XxDiCaprioxX,mixed,peaceful,Harun is quite peaceful but becomes stronger on higher difficulties.,im_a_noob_can_you_describe_all_civ_personalities,True,1
Ashurbanipal,u/XxDiCaprioxX,negative,warmonger,Ashurbanipal is an annoying warmonger likely to attack you early at least once.,im_a_noob_can_you_describe_all_civ_personalities,True,1
Maria Theresia,u/XxDiCaprioxX,mixed,diplomatic,Maria Theresia is non-aggressive but becomes diplomatically annoying regardless.,im_a_noob_can_you_describe_all_civ_personalities,True,1
Montezuma,u/XxDiCaprioxX,negative,warmonger,Montezuma is a huge warmonger who attacks early and constantly seeks war.,im_a_noob_can_you_describe_all_civ_personalities,True,1
Nebuchadnezzar,u/XxDiCaprioxX,mixed,peaceful,Nebuchadnezzar focuses on science and rarely declares war but is unfriendly.,im_a_noob_can_you_describe_all_civ_personalities,True,1
Pedro,u/XxDiCaprioxX,mixed,diplomatic,"Pedro is loyal and friendly until he sees you as a threat, then diplomatically hostile.",im_a_noob_can_you_describe_all_civ_personalities,True,1
Theodora,u/XxDiCaprioxX,mixed,religious,Theodora is neutral and peaceful but spams missionaries aggressively.,im_a_noob_can_you_describe_all_civ_personalities,True,1
Dido,u/XxDiCaprioxX,negative,backstabber,Dido backstabs throughout the game while focusing on expansion.,im_a_noob_can_you_describe_all_civ_personalities,True,1
Boudicca,u/XxDiCaprioxX,mixed,warmonger,Boudicca is mostly loyal but may attack early if your military is weak.,im_a_noob_can_you_describe_all_civ_personalities,True,1
Wu Zetian,u/XxDiCaprioxX,mixed,warmonger,Wu Zetian builds a sizeable army but is not particularly aggressive overall.,im_a_noob_can_you_describe_all_civ_personalities,True,1
Harald Bluetooth,u/XxDiCaprioxX,negative,warmonger,Harald Bluetooth is an aggressive warmonger who builds large armies for attacks.,im_a_noob_can_you_describe_all_civ_personalities,True,1
William,u/XxDiCaprioxX,mixed,diplomatic,"William focuses solely on trade and diplomacy, never building a real army.",im_a_noob_can_you_describe_all_civ_personalities,True,1
Ramesses,u/XxDiCaprioxX,mixed,wonder_builder,Ramesses spams wonders and sends missionaries but avoids war unless certain of victory.,im_a_noob_can_you_describe_all_civ_personalities,True,1
Elizabeth,unknown,mixed,diplomatic,Elizabeth builds a navy but is reserved and slow to change opinions.,im_a_noob_can_you_describe_all_civ_personalities,True,1
Haile Selassie,unknown,negative,warmonger,"Selassie is cocky, gets caught in wars, and gets annoyed easily.",im_a_noob_can_you_describe_all_civ_personalities,True,1
Napoleon,unknown,mixed,wonder_builder,"Napoleon is balanced but unremarkable, likely ending up on the weaker side.",im_a_noob_can_you_describe_all_civ_personalities,True,1
Bismarck,unknown,mixed,diplomatic,Bismarck is a loyal ally but causes diplomatic turmoil throughout the game.,im_a_noob_can_you_describe_all_civ_personalities,True,1
Alexander,unknown,negative,backstabber,Alexander buys all city states then declares war regardless of relations.,im_a_noob_can_you_describe_all_civ_personalities,True,1
Attila,unknown,negative,warmonger,Attila will likely attack you if you are his neighbor.,im_a_noob_can_you_describe_all_civ_personalities,True,1
Pachacuti,unknown,mixed,unpredictable,Pachacuti starts friendly but turns hostile faster than most other leaders.,im_a_noob_can_you_describe_all_civ_personalities,True,1
Gandhi,unknown,mixed,peaceful,Gandhi loves peace but also nukes and denounces any aggression.,im_a_noob_can_you_describe_all_civ_personalities,True,1
Gajah Mada,unknown,negative,backstabber,"Gajah Mada is disloyal, spams missionaries, and frequently starts wars.",im_a_noob_can_you_describe_all_civ_personalities,True,1
Hiawatha,unknown,mixed,expansionist,Hiawatha is peaceful and loyal but aggressively grabs enormous amounts of land.,im_a_noob_can_you_describe_all_civ_personalities,True,1
Oda Nobunaga,unknown,negative,warmonger,Oda Nobunaga attempts wars but fails miserably in the vast majority of cases.,im_a_noob_can_you_describe_all_civ_personalities,True,1
Sejong,unknown,negative,peaceful,"Sejong isolates himself and focuses on science, threatening a science victory.",im_a_noob_can_you_describe_all_civ_personalities,True,1
Pacal,unknown,negative,wonder_builder,"Pacal builds many wonders, spams missionaries, and inevitably goes to war.",im_a_noob_can_you_describe_all_civ_personalities,True,1
Genghis Khan,unknown,mixed,warmonger,Genghis Khan attacks city states and is loyal but often gets defeated by other AIs.,im_a_noob_can_you_describe_all_civ_personalities,True,1
Ahmad,unknown,positive,diplomatic,"Ahmad builds a strong economy, plays defensively, and is very diplomatically active.",im_a_noob_can_you_describe_all_civ_personalities,True,1
Suleyman,unknown,mixed,warmonger,Suleyman builds military forces but uses them ineffectively in war.,im_a_noob_can_you_describe_all_civ_personalities,True,1
Darius,unknown,mixed,unpredictable,Darius is described as average across all aspects of gameplay.,im_a_noob_can_you_describe_all_civ_personalities,True,1
Casimir,unknown,negative,warmonger,Casimir builds winged hussars and aggressively attacks nearby civilizations.,im_a_noob_can_you_describe_all_civ_personalities,True,1
Kamehameha,unknown,mixed,expansionist,Kamehameha forward-settles aggressively but remains friendly if not dominant.,im_a_noob_can_you_describe_all_civ_personalities,True,1
Maria,unknown,negative,unpredictable,Maria is dismissed negatively with no specific gameplay traits elaborated.,im_a_noob_can_you_describe_all_civ_personalities,True,1
Augustus,unknown,mixed,warmonger,Augustus focuses on military and cities but falls off after the Renaissance.,im_a_noob_can_you_describe_all_civ_personalities,True,1
Catherine,unknown,positive,expansionist,Catherine snowballs effectively with strong resource and army development.,im_a_noob_can_you_describe_all_civ_personalities,True,1
Pocatello,unknown,negative,city_spammer,Pocatello grabs excessive land and settles cities everywhere aggressively.,im_a_noob_can_you_describe_all_civ_personalities,True,1
Ramlhamhaeng,unknown,negative,diplomatic,Ramlhamhaeng focuses on city-state alliances and constantly denounces neighbors.,im_a_noob_can_you_describe_all_civ_personalities,True,1
Askia,unknown,mixed,religious,Askia aggressively spreads religion but can declare war in the late game.,im_a_noob_can_you_describe_all_civ_personalities,True,1
Isabella,unknown,mixed,religious,Isabella has a volatile personality and becomes extremely aggressive with religion.,im_a_noob_can_you_describe_all_civ_personalities,True,1
Gustavus Adolphus,unknown,mixed,diplomatic,Gustavus befriends everyone and focuses on great people and city growth.,im_a_noob_can_you_describe_all_civ_personalities,True,1
Enrico Dandolo,unknown,mixed,diplomatic,Enrico focuses on trading and buying city-state alliances throughout the game.,im_a_noob_can_you_describe_all_civ_personalities,True,1
Shaka,unknown,negative,warmonger,Shaka constantly declares war on neighbors but is loyal to stronger allies.,im_a_noob_can_you_describe_all_civ_personalities,True,1
Shaka,u/Robdd123,mixed,warmonger,"Shaka has extreme expansion and warmonger scores, making him unpredictably aggressive.",im_a_noob_can_you_describe_all_civ_personalities,True,1
Askia,u/PeanutButter1Butter,mixed,religious,Askia repeatedly sends missionaries to neighbors.,im_a_noob_can_you_describe_all_civ_personalities,True,1
Poland,u/PeanutButter1Butter,negative,warmonger,Poland acts as a warmonger specifically against AI neighbors.,im_a_noob_can_you_describe_all_civ_personalities,True,1
Caesar,unknown,negative,warmonger,Caesar is grouped with civs that aggressively declare war throughout the game.,im_a_noob_can_you_describe_all_civ_personalities,True,1
Gandhi,u/Whotakesmename,negative,warmonger,Gandhi is ironically associated with nuclear warfare in the comment.,im_a_noob_can_you_describe_all_civ_personalities,True,1
Shaka,u/Whotakesmename,negative,warmonger,"Shaka is described simply as himself, implying notorious aggressive reputation.",im_a_noob_can_you_describe_all_civ_personalities,True,1
Alexander the Great,u/KalegNar,negative,warmonger,Alexander repeatedly declares war and sends settlers aggressively across borders.,most_annoying_civ_in_the_game,True,1
Alexander,2woke4ufgt,negative,diplomatic,Alexander uses city-state votes to ban luxuries and embargo players in World Congress.,most_annoying_civ_in_the_game,True,1
Alexander,unknown,negative,diplomatic,Alexander dominates World Congress with city-state allies to bully leading players.,most_annoying_civ_in_the_game,True,1
Alexander,Crit-Monkey,negative,diplomatic,Alexander's diplomatic dominance forces the player to disable diplomatic victory.,most_annoying_civ_in_the_game,True,1
Shaka,u/Muffjuggler1295,negative,warmonger,Shaka is considered highly annoying when located nearby the player.,most_annoying_civ_in_the_game,True,1
Haile Selassie,u/Muffjuggler1295,negative,unpredictable,Ethiopia is mentioned as a secondary annoyance after Shaka.,most_annoying_civ_in_the_game,True,1
Haile Selassie,jumpsmash5,negative,religious,Spams missionaries and prophets nonstop and is annoying about wonders.,most_annoying_civ_in_the_game,True,1
Hiawatha,RedBaronKaren,negative,city_spammer,Mentioned due to constant city spam across all available land.,most_annoying_civ_in_the_game,True,18
Ramkhamhaeng,RedBaronKaren,negative,expansionist,Close second to Hiawatha due to constantly spying on the player.,most_annoying_civ_in_the_game,True,18
Alexander,Robdd123,negative,diplomatic,Everyone agrees Alexander is annoying; he hogs city states and spirals out of control.,most_annoying_civ_in_the_game,True,14
Dido,XxDiCaprioxX,negative,backstabber,"Declares war, asks for friendship, backstabs, and denounces unpredictably.",most_annoying_civ_in_the_game,True,1
Boudicca,XxDiCaprioxX,mixed,warmonger,Usually gets beaten up early but spams missionaries throughout the game.,most_annoying_civ_in_the_game,True,1
Hiawatha,XxDiCaprioxX,negative,city_spammer,Spams cities everywhere making it hard to navigate through his territory.,most_annoying_civ_in_the_game,True,1
Ramkhamhaeng,XxDiCaprioxX,negative,expansionist,Plants cities extremely close to your capital as a consistent strategy.,most_annoying_civ_in_the_game,True,1
Venice,XxDiCaprioxX,negative,wonder_builder,Buys city states permanently and spams wonders annoyingly.,most_annoying_civ_in_the_game,True,1
Dido,KrandoxReddit,negative,backstabber,Tried to manipulate war declarations while befriending the same target simultaneously.,most_annoying_civ_in_the_game,True,2
Hiawatha,2woke4ufgt,negative,city_spammer,Explicitly called out for spamming cities everywhere.,most_annoying_civ_in_the_game,True,1
Boudicca,2woke4ufgt,negative,religious,Described as spamming missionaries everywhere throughout the game.,most_annoying_civ_in_the_game,True,1
Ramkhamhaeng,2woke4ufgt,negative,unpredictable,Simply described as a annoyance with no further specific archetype detail.,most_annoying_civ_in_the_game,True,1
Haile Selassie,2woke4ufgt,negative,religious,Described as similar to Boudicca but slightly less annoying overall.,most_annoying_civ_in_the_game,True,1
Korea,KrandoxReddit,negative,warmonger,Either eliminated early or becomes a science monster threatening a Deity win.,most_annoying_civ_in_the_game,True,2
Greece,u/flyfire2002,negative,expansionist,Greece is a dangerous neighbor known for snatching city states aggressively.,most_annoying_civ_in_the_game,True,1
Inca,u/flyfire2002,negative,warmonger,Inca becomes frighteningly powerful in tech and warfare if left unchecked.,most_annoying_civ_in_the_game,True,1
The Netherlands,u/wyvernzu1,positive,diplomatic,Ranked among the best AIs to have when pursuing a science victory.,most_annoying_civ_in_the_game,True,1
Arabia,u/wyvernzu1,positive,diplomatic,Ranked among the best AIs to have when pursuing a science victory.,most_annoying_civ_in_the_game,True,1
Morocco,u/wyvernzu1,positive,diplomatic,Ranked among the best AIs to have when pursuing a science victory.,most_annoying_civ_in_the_game,True,1
Sweden,u/wyvernzu1,positive,diplomatic,Ranked among the best AIs to have when pursuing a science victory.,most_annoying_civ_in_the_game,True,1
Ethiopia,u/wyvernzu1,positive,religious,Ranked among the best AIs to have when pursuing a science victory.,most_annoying_civ_in_the_game,True,1
The Maya,u/wyvernzu1,positive,wonder_builder,Ranked among the best AIs to have when pursuing a science victory.,most_annoying_civ_in_the_game,True,1
Brazil,u/wyvernzu1,positive,diplomatic,Ranked among the best AIs to have when pursuing a science victory.,most_annoying_civ_in_the_game,True,1
The Zulu,u/wyvernzu1,negative,warmonger,Ranked among the worst AIs when pursuing a science victory on Deity.,most_annoying_civ_in_the_game,True,1
Greece,u/wyvernzu1,negative,expansionist,Ranked among the worst AIs when pursuing a science victory on Deity.,most_annoying_civ_in_the_game,True,1
The Iroquois,u/wyvernzu1,negative,expansionist,Ranked among the worst AIs when pursuing a science victory on Deity.,most_annoying_civ_in_the_game,True,1
England,u/wyvernzu1,negative,warmonger,Ranked among the worst AIs when pursuing a science victory on Deity.,most_annoying_civ_in_the_game,True,1
The Shoshone,u/wyvernzu1,negative,expansionist,Ranked among the worst AIs when pursuing a science victory on Deity.,most_annoying_civ_in_the_game,True,1
Polynesia,u/wyvernzu1,negative,expansionist,Ranked among the worst AIs when pursuing a science victory on Deity.,most_annoying_civ_in_the_game,True,1
Venice,u/wyvernzu1,negative,diplomatic,Ranked among the worst AIs when pursuing a science victory on Deity.,most_annoying_civ_in_the_game,True,1
Venice,u/iamchuckdizzle,mixed,diplomatic,Venice buys city states but can also give the player free real estate.,most_annoying_civ_in_the_game,True,1
Attila,DebilWG,negative,warmonger,Attila constantly attacks and forces players to neglect infrastructure for military.,most_annoying_civ_in_the_game,True,1
Austria,u/bikes_r_us,negative,diplomatic,Austria buys all city states and uses them to plant cities on your borders.,most_annoying_civ_in_the_game,True,1
Alexander,White_Lord,negative,warmonger,"Alexander is implied to be notoriously dangerous, shocking those unfamiliar with him.",most_annoying_civ_in_the_game,True,1
Attila the hun,u/civnub,negative,warmonger,"Attila forces massive military spending, leaving no room for development or wonders.",most_annoying_civ_in_the_game,True,1
Egypt,SuperDevton112,negative,wonder_builder,"Egypt builds ancient wonders too quickly, denying them to other players.",most_annoying_civ_in_the_game,True,1
Maya,u/CMDR_black_vegetable,mixed,wonder_builder,Maya steals religious wonders but is peaceful enough to exploit as a neighbor.,most_annoying_civ_in_the_game,True,1
George Washington,unknown,mixed,diplomatic,Annoying as neighbor but good ally who DoFs easily and joins wars.,most_annoying_civ_in_the_game,True,1
Carthage,Rameon_Dryan716,negative,expansionist,Mentioned with a frown emoji suggesting frustration with Carthage.,most_annoying_civ_in_the_game,True,1
Ghengis Khan,unknown,negative,backstabber,Kept spying repeatedly and manipulated peace treaties to avoid consequences.,most_annoying_civ_in_the_game,True,1
Genghis,unknown,negative,warmonger,"Prone to killing cultural city-states, useful only as a denouncing target.",most_annoying_civ_in_the_game,True,1
Askia,Rameon_Dryan716,negative,warmonger,Attacks city-states and nearby civs instead of distant enemies.,most_annoying_civ_in_the_game,True,1
Askia,unknown,mixed,warmonger,"Warmongering early but shifts to diplomacy late, boom or bust performance.",most_annoying_civ_in_the_game,True,1
Indonesia,unknown,negative,backstabber,Described as a deceptive warmonger who hypocritically hates warmongers.,most_annoying_civ_in_the_game,True,1
Oda,unknown,negative,warmonger,"Called a plain psychopath, harder to deal with than Shaka or Attila.",most_annoying_civ_in_the_game,True,1
Pocatello,jorgepinata,mixed,expansionist,Friendly personality but his UA grabs territory aggressively as a neighbor.,most_annoying_civ_in_the_game,True,2
Pocatello,2woke4ufgt,negative,expansionist,Second settler stole all workable tiles by turn 3 on Deity.,most_annoying_civ_in_the_game,True,1
Alexander the Great,tevoibataie,negative,unpredictable,"Mentioned with no comment, implying obvious notorious reputation.",most_annoying_civ_in_the_game,True,2
Isabella,ruiluth,negative,backstabber,Always backstabbing and getting aggressive over religious differences.,most_annoying_civ_in_the_game,True,2
France,Tripredacus-Agent,negative,warmonger,Always appears early and threatens militarily with superior forces.,most_annoying_civ_in_the_game,True,1
Zulu,alodemonidGD,negative,warmonger,Disliked enough to mention despite forgetting the leader's name.,most_annoying_civ_in_the_game,True,1
Siam,unknown,mixed,warmonger,A meme warmonger who hates warmongers but often eliminated before Industrial era.,most_annoying_civ_in_the_game,True,1
Marbozir,2woke4ufgt,negative,expansionist,Marbozir tends to forward settle and complain about city state relationships.,most_annoying_civ_in_the_game,True,1
Marbozir,Hour-Shelter-2541,negative,backstabber,He backstabs in about half the games played with him.,most_annoying_civ_in_the_game,True,1
Marbozir,thedogz11,negative,backstabber,"He acted friendly, accepted gifts and open borders, then declared war shortly after.",most_annoying_civ_in_the_game,True,1
Ramkanghang,CertifiedBreads,negative,religious,He converts your cities with prophets even after agreeing not to.,most_annoying_civ_in_the_game,True,1
Genghis Khan,G3llade,negative,warmonger,Frequently appears and causes trouble in games.,most_annoying_civ_in_the_game,True,1
Ashurbanipal,G3llade,negative,diplomatic,Constantly appears and aggressively marries city states as Austria.,most_annoying_civ_in_the_game,True,1
Maria Theresa,G3llade,negative,diplomatic,She frequently married around 4 city states in one emperor game.,most_annoying_civ_in_the_game,True,1
Bou,SaveEmailB4Logout,mixed,religious,She is fair with religion but unforgiving if you cross her first.,most_annoying_civ_in_the_game,True,1
Isabella,SaveEmailB4Logout,negative,religious,Mentioned as aggressively spamming prophets and missionaries unlike Bou.,most_annoying_civ_in_the_game,True,1
Theodora,SaveEmailB4Logout,negative,religious,"Spams religious units and unlike Bou, will forgive transgressions.",most_annoying_civ_in_the_game,True,1
Napoleon,SaveEmailB4Logout,mixed,unpredictable,"Unlike Bou, Napoleon will forgive you if you step on his toes.",most_annoying_civ_in_the_game,True,1
Shaka,Thrillhouse763,negative,warmonger,"Mentioned negatively with no further elaboration, implying notorious reputation.",most_annoying_civ_in_the_game,True,1
Attila,XxDiCaprioxX,negative,warmonger,"Mentioned negatively with no further elaboration, implying notorious reputation.",most_annoying_civ_in_the_game,True,1
Indonesia,TomHast03,negative,unpredictable,"Kept mocking the player even after being completely defeated, requiring a nuclear strike.",most_annoying_civ_in_the_game,True,1
Pedro II,unknown,positive,peaceful,Pedro II is very peaceful and always willing to declare friendship.,which_ai_leaders_do_you_like_and_hate,True,1
Gandhi,unknown,mixed,peaceful,Gandhi is peaceful and friendly but occasionally goes berserk unexpectedly.,which_ai_leaders_do_you_like_and_hate,True,1
Ahmad Al-Mansur,unknown,positive,peaceful,Al-Mansur is peaceful but takes longer to befriend than others.,which_ai_leaders_do_you_like_and_hate,True,1
Askia,unknown,mixed,unpredictable,Askia can be a best friend or worst enemy depending on the game.,which_ai_leaders_do_you_like_and_hate,True,1
Genghis Khan,unknown,mixed,warmonger,Genghis is a good war ally but a dangerous and aggressive neighbor.,which_ai_leaders_do_you_like_and_hate,True,1
Kamehameha,unknown,mixed,unpredictable,Kamehameha is a good friend when not neighbors but unpredictably expansionist.,which_ai_leaders_do_you_like_and_hate,True,1
Sejong,unknown,mixed,expansionist,Sejong is friendly but becomes a massive science and expansion threat.,which_ai_leaders_do_you_like_and_hate,True,1
Harald Bluetooth,unknown,mixed,warmonger,Harald is usually friendly but dangerously aggressive when a neighbor.,which_ai_leaders_do_you_like_and_hate,True,1
Alexander,unknown,negative,expansionist,"Alexander is highly expansionist, declares war randomly, and dominates city-states.",which_ai_leaders_do_you_like_and_hate,True,1
Ramkhamhaeng,unknown,negative,backstabber,Ramkhamhaeng betrays allies once they are no longer useful to him.,which_ai_leaders_do_you_like_and_hate,True,1
Harun al-Rashid,unknown,negative,religious,"Harun constantly declares war, spams missionaries, and forward settles aggressively.",which_ai_leaders_do_you_like_and_hate,True,1
Hiawatha,unknown,negative,city_spammer,"Hiawatha is the best city-spammer, reaching 10+ cities by Renaissance era.",which_ai_leaders_do_you_like_and_hate,True,1
Darius I,unknown,negative,city_spammer,Darius I ruins games through relentless forward settling like Hiawatha.,which_ai_leaders_do_you_like_and_hate,True,1
George Washington,unknown,negative,expansionist,"Washington is disloyal, denounce-happy, and always pursues aggressive expansion.",which_ai_leaders_do_you_like_and_hate,True,1
Elizabeth,unknown,negative,expansionist,Elizabeth is a huge expansionist threat and gets hostile for the slightest reasons.,which_ai_leaders_do_you_like_and_hate,True,1
Pocatello,unknown,negative,expansionist,"Pocatello aggressively claims land tiles, leaving no room for neighbors.",which_ai_leaders_do_you_like_and_hate,True,1
Alexander,matthkamis,negative,warmonger,"Alexander is universally hated, implying consistent aggressive behavior.",which_ai_leaders_do_you_like_and_hate,True,1
Enrico Dandolo,ngshafer,negative,diplomatic,Enrico Dandolo is so despised the author makes it a priority to kill him.,which_ai_leaders_do_you_like_and_hate,True,21
Enrico Dandolo,Chookity-poks,negative,diplomatic,"Enrico messes with city-states, which infuriates the author.",which_ai_leaders_do_you_like_and_hate,True,1
Maria Theresa,Chookity-poks,negative,diplomatic,"Maria Theresa interferes with city-states, angering the author.",which_ai_leaders_do_you_like_and_hate,True,1
Pedro,Chintek45,positive,peaceful,Pedro is chill and friendly as long as you are not a warmonger.,which_ai_leaders_do_you_like_and_hate,True,6
Gandhi,Chintek45,positive,peaceful,Gandhi is chill and almost always friendly with no issues reported.,which_ai_leaders_do_you_like_and_hate,True,6
Ahmad al-Mansour,Chintek45,positive,peaceful,Ahmad al-Mansour is consistently peaceful and never causes issues.,which_ai_leaders_do_you_like_and_hate,True,6
Enrico Dandolo,Chintek45,negative,city_spammer,Dandolo buys every city-state and constantly spams Missionaries.,which_ai_leaders_do_you_like_and_hate,True,6
Alexander,Chintek45,negative,city_spammer,"Alexander spams cities, forward-settles, steals city-state allies, and declares war.",which_ai_leaders_do_you_like_and_hate,True,6
Haile Selassie,Chintek45,negative,religious,Selassie immediately maxes Piety and spams Missionaries and Great Prophets.,which_ai_leaders_do_you_like_and_hate,True,6
Hiawatha,Chintek45,negative,city_spammer,Hiawatha is hated for obvious city-spamming reasons.,which_ai_leaders_do_you_like_and_hate,True,6
Harun al-Rashid,Chintek45,negative,city_spammer,"Harun al-Rashid is noted for city spam, though less than Hiawatha.",which_ai_leaders_do_you_like_and_hate,True,6
Casimir,Chintek45,negative,city_spammer,"Casimir is noted for city spam, though less than Hiawatha.",which_ai_leaders_do_you_like_and_hate,True,6
Catherine,Chintek45,negative,city_spammer,"Catherine is noted for city spam, though less than Hiawatha.",which_ai_leaders_do_you_like_and_hate,True,6
Washington,Chintek45,mixed,backstabber,Washington is normally friendly but backstabs and declares war when you are weaker.,which_ai_leaders_do_you_like_and_hate,True,6
Gandhi,Gibs960,negative,unpredictable,"Gandhi promised war support but sent no units, costing the author two cities.",which_ai_leaders_do_you_like_and_hate,True,1
Suleiman,Experimentzz,mixed,backstabber,Suleiman was a reliable ally all game but randomly backstabbed in the industrial era.,which_ai_leaders_do_you_like_and_hate,True,5
Alexander,Bicepticlops,negative,warmonger,Alexander immediately denounced and declared war nonstop from the very first meeting.,which_ai_leaders_do_you_like_and_hate,True,1
Alexander,Voffmjau,negative,warmonger,Spawning next to Alexander without a godlike start is cause to quit immediately.,which_ai_leaders_do_you_like_and_hate,True,1
Alexander,christine-bitg,negative,diplomatic,Alexander controls city states and manipulates World Congress votes against players.,which_ai_leaders_do_you_like_and_hate,True,1
Montezuma,christine-bitg,negative,warmonger,Montezuma is described as forever aggressive toward the player.,which_ai_leaders_do_you_like_and_hate,True,1
Shaka,christine-bitg,negative,warmonger,"The Zulu leader is described as too aggressive, similar to Montezuma.",which_ai_leaders_do_you_like_and_hate,True,1
Hiawatha,YogurtclosetPale8785,negative,expansionist,Hiawatha is mentioned with strong frustration and no further elaboration.,which_ai_leaders_do_you_like_and_hate,True,1
Maria Theresa,Hopeful-Repair-1121,negative,expansionist,Maria Theresa absorbs allied city states and denounces players without reason.,which_ai_leaders_do_you_like_and_hate,True,1
